"author/blue_verified","author/can_dm","author/description","author/image","author/name","author/rest_id","author/screen_name","author/sub_count","bookmarks","conversation_id","created_at","display_text","entities/hashtags/0/indices/0","entities/hashtags/0/indices/1","entities/hashtags/0/text","entities/hashtags/1/indices/0","entities/hashtags/1/indices/1","entities/hashtags/1/text","entities/media/0/display_url","entities/media/0/expanded_url","entities/media/0/ext_alt_text","entities/media/0/ext_media_availability/status","entities/media/0/features/large/faces/0/h","entities/media/0/features/large/faces/0/w","entities/media/0/features/large/faces/0/x","entities/media/0/features/large/faces/0/y","entities/media/0/features/large/faces/1/h","entities/media/0/features/large/faces/1/w","entities/media/0/features/large/faces/1/x","entities/media/0/features/large/faces/1/y","entities/media/0/features/medium/faces/0/h","entities/media/0/features/medium/faces/0/w","entities/media/0/features/medium/faces/0/x","entities/media/0/features/medium/faces/0/y","entities/media/0/features/medium/faces/1/h","entities/media/0/features/medium/faces/1/w","entities/media/0/features/medium/faces/1/x","entities/media/0/features/medium/faces/1/y","entities/media/0/features/orig/faces/0/h","entities/media/0/features/orig/faces/0/w","entities/media/0/features/orig/faces/0/x","entities/media/0/features/orig/faces/0/y","entities/media/0/features/orig/faces/1/h","entities/media/0/features/orig/faces/1/w","entities/media/0/features/orig/faces/1/x","entities/media/0/features/orig/faces/1/y","entities/media/0/features/small/faces/0/h","entities/media/0/features/small/faces/0/w","entities/media/0/features/small/faces/0/x","entities/media/0/features/small/faces/0/y","entities/media/0/features/small/faces/1/h","entities/media/0/features/small/faces/1/w","entities/media/0/features/small/faces/1/x","entities/media/0/features/small/faces/1/y","entities/media/0/id_str","entities/media/0/indices/0","entities/media/0/indices/1","entities/media/0/media_key","entities/media/0/media_results/result/media_key","entities/media/0/media_url_https","entities/media/0/original_info/focus_rects/0/h","entities/media/0/original_info/focus_rects/0/w","entities/media/0/original_info/focus_rects/0/x","entities/media/0/original_info/focus_rects/0/y","entities/media/0/original_info/focus_rects/1/h","entities/media/0/original_info/focus_rects/1/w","entities/media/0/original_info/focus_rects/1/x","entities/media/0/original_info/focus_rects/1/y","entities/media/0/original_info/focus_rects/2/h","entities/media/0/original_info/focus_rects/2/w","entities/media/0/original_info/focus_rects/2/x","entities/media/0/original_info/focus_rects/2/y","entities/media/0/original_info/focus_rects/3/h","entities/media/0/original_info/focus_rects/3/w","entities/media/0/original_info/focus_rects/3/x","entities/media/0/original_info/focus_rects/3/y","entities/media/0/original_info/focus_rects/4/h","entities/media/0/original_info/focus_rects/4/w","entities/media/0/original_info/focus_rects/4/x","entities/media/0/original_info/focus_rects/4/y","entities/media/0/original_info/height","entities/media/0/original_info/width","entities/media/0/sizes/large/h","entities/media/0/sizes/large/resize","entities/media/0/sizes/large/w","entities/media/0/sizes/medium/h","entities/media/0/sizes/medium/resize","entities/media/0/sizes/medium/w","entities/media/0/sizes/small/h","entities/media/0/sizes/small/resize","entities/media/0/sizes/small/w","entities/media/0/sizes/thumb/h","entities/media/0/sizes/thumb/resize","entities/media/0/sizes/thumb/w","entities/media/0/type","entities/media/0/url","entities/media/0/video_info/aspect_ratio/0","entities/media/0/video_info/aspect_ratio/1","entities/media/0/video_info/variants/0/bitrate","entities/media/0/video_info/variants/0/content_type","entities/media/0/video_info/variants/0/url","entities/urls/0/display_url","entities/urls/0/expanded_url","entities/urls/0/indices/0","entities/urls/0/indices/1","entities/urls/0/url","entities/user_mentions/0/id_str","entities/user_mentions/0/indices/0","entities/user_mentions/0/indices/1","entities/user_mentions/0/name","entities/user_mentions/0/screen_name","entities/user_mentions/1/id_str","entities/user_mentions/1/indices/0","entities/user_mentions/1/indices/1","entities/user_mentions/1/name","entities/user_mentions/1/screen_name","id","lang","likes","media/photo/0/id","media/photo/0/media_url_https","media/video/0/aspect_ratio/0","media/video/0/aspect_ratio/1","media/video/0/duration","media/video/0/id","media/video/0/media_url_https","media/video/0/original_info/height","media/video/0/original_info/width","media/video/0/variants/0/bitrate","media/video/0/variants/0/content_type","media/video/0/variants/0/url","place/country","place/country_code","place/full_name","place/more_data_url","place/name","place/place_type","quotes","replies","retweets","status","text","views"
"true","false","Came to help Tesla and Elon, stayed to watch the future being built. ᚨᚲ All of this has happened before, and all of this will happen again. ᛊᚠ ☩ So it goes..","https://pbs.twimg.com/profile_images/2032096104162922496/XK9-iNjn_normal.jpg","Goldfiinger ⚡️ᛇᛉ","1185493683153592320","Goldfiinger","2470","1","1414623345291714567","Mon Jul 12 18:10:30 +0000 2021","I hope one-day justice catches up with you. 

Children are not at risk. This is utter abuse to wrap small children’s faces with masks as they learn to interact. 

Criminal.",,,,,,,,,,,,,,,,,,,,,,,,,,,,,,,,,,,,,,,,,,,,,,,,,,,,,,,,,,,,,,,,,,,,,,,,,,,,,,,,,,,,,,,,,,,,,,,"146569971","0","7","CDC","CDCgov",,,,,,"1414648374553415685","en","388",,,,,,,,,,,,,,,,,,,"0","2","20","active","@CDCgov I hope one-day justice catches up with you. 

Children are not at risk. This is utter abuse to wrap small children’s faces with masks as they learn to interact. 

Criminal.",
"false","false","Analytical. Objectivist. Socratic. 
PhD student in History. History Master's graduate. 

Think for yourself, logic is there to be found.","https://pbs.twimg.com/profile_images/1521945518049480704/_cZ597nF_normal.jpg","Michael Schofield","44479963","M_J_Schofield","1190","0","1414623345291714567","Mon Jul 12 19:44:34 +0000 2021","Don't mask children. Taking away social interaction with the whole face is such a move away from our natural state of dealing with each other and children need to develop it all properly. Depriving natural expressions is a hideous price to push some deaths back a few months.",,,,,,,,,,,,,,,,,,,,,,,,,,,,,,,,,,,,,,,,,,,,,,,,,,,,,,,,,,,,,,,,,,,,,,,,,,,,,,,,,,,,,,,,,,,,,,,"146569971","0","7","CDC","CDCgov",,,,,,"1414672049017065483","en","249",,,,,,,,,,,,,,,,,,,"0","3","12","active","@CDCgov Don't mask children. Taking away social interaction with the whole face is such a move away from our natural state of dealing with each other and children need to develop it all properly. Depriving natural expressions is a hideous price to push some deaths back a few months.",
"false","true","Mom of 4. Survivor of Winters of Severe Illness and Death 💀","https://pbs.twimg.com/profile_images/981650083312689153/4SZaCBk2_normal.jpg","Dana Hensley","15238081","DanaMarie262","1765","0","1414623345291714567","Mon Jul 12 17:46:43 +0000 2021","Do you know anything about language and child development?",,,,,,,,,,,,,,,,,,,,,,,,,,,,,,,,,,,,,,,,,,,,,,,,,,,,,,,,,,,,,,,,,,,,,,,,,,,,,,,,,,,,,,,,,,,,,,,"146569971","0","7","CDC","CDCgov",,,,,,"1414642389520617477","en","247",,,,,,,,,,,,,,,,,,,"0","11","8","active","@CDCgov Do you know anything about language and child development?",
"true","true","Dad, husband, runner, linguist, classical liberal, lawyer. Polite online 🌈 Won 2012 Salmon Marathon 🇺🇸🇲🇽🇫🇷🇩🇪 En la vida y en la cancha #ChingaLaMigra","https://pbs.twimg.com/profile_images/1318551336963760132/4kBdZmYc_normal.jpg","John Fenton","36915846","jhfenton","1097","0","1414623345291714567","Mon Jul 12 18:04:36 +0000 2021","You should have stopped after the second sentence: Keep them home if sick.

The rest is unscientific fear-mongering.",,,,,,,,,,,,,,,,,,,,,,,,,,,,,,,,,,,,,,,,,,,,,,,,,,,,,,,,,,,,,,,,,,,,,,,,,,,,,,,,,,,,,,,,,,,,,,,"146569971","0","7","CDC","CDCgov",,,,,,"1414646892772970498","en","244",,,,,,,,,,,,,,,,,,,"0","3","7","active","@CDCgov You should have stopped after the second sentence: Keep them home if sick.

The rest is unscientific fear-mongering.",
"false","false","Dad, Husband, America First","https://pbs.twimg.com/profile_images/1456727361249030147/nAR7Iyjk_normal.jpg","All American","1035918790985428992","Trophy_Husband5","1456","0","1414623345291714567","Mon Jul 12 18:08:16 +0000 2021","Terrible advice.  No one needs a mask.",,,,,,,,,,,,,,,,,,,,,,,,,,,,,,,,,,,,,,,,,,,,,,,,,,,,,,,,,,,,,,,,,,,,,,,,,,,,,,,,,,,,,,,,,,,,,,,"146569971","0","7","CDC","CDCgov",,,,,,"1414647813842128899","en","227",,,,,,,,,,,,,,,,,,,"0","1","4","active","@CDCgov Terrible advice.  No one needs a mask.",
"true","true","my Hermes is better then yours","https://pbs.twimg.com/profile_images/2028595772653289472/5tIXPseg_normal.jpg","drizzy8423","323310623","sheeptweetZ","2870","0","1414623345291714567","Mon Jul 12 17:56:02 +0000 2021","Reported for misinformation",,,,,,,,,,,,,,,,,,,,,,,,,,,,,,,,,,,,,,,,,,,,,,,,,,,,,,,,,,,,,,,,,,,,,,,,,,,,,,,,,,,,,,,,,,,,,,,"146569971","0","7","CDC","CDCgov",,,,,,"1414644736942645253","en","200",,,,,,,,,,,,,,,,,,,"0","2","2","active","@CDCgov Reported for misinformation",
"false","true","","https://pbs.twimg.com/profile_images/1313087827014496256/-rIFrYbO_normal.jpg","Neil","554158405","NeilSmithers","242","0","1414623345291714567","Mon Jul 12 20:12:55 +0000 2021","Putting a muzzle on kids is child abuse. Leave them alone.",,,,,,,,,,,,,,,,,,,,,,,,,,,,,,,,,,,,,,,,,,,,,,,,,,,,,,,,,,,,,,,,,,,,,,,,,,,,,,,,,,,,,,,,,,,,,,,"146569971","0","7","CDC","CDCgov",,,,,,"1414679183574380550","en","192",,,,,,,,,,,,,,,,,,,"0","1","6","active","@CDCgov Putting a muzzle on kids is child abuse. Leave them alone.",
"false","true","90 minute livestream stand-up show on zoom New Year's Eve. Baltimore 1/2&3. 1/11 Lancaster, PA. Tickets https://t.co/vo7gNFUCDJ","https://pbs.twimg.com/profile_images/925263013925416960/lL9zaiJl_normal.jpg","Judah Friedlander","28744383","JudahWorldChamp","316758","0","1414623345291714567","Tue Jul 13 15:18:41 +0000 2021","Since it’s a virus that spreads through the air, why do you not recommend n95 masks which protect against airborne?",,,,,,,,,,,,,,,,,,,,,,,,,,,,,,,,,,,,,,,,,,,,,,,,,,,,,,,,,,,,,,,,,,,,,,,,,,,,,,,,,,,,,,,,,,,,,,,"146569971","0","7","CDC","CDCgov",,,,,,"1414967525272657924","en","1",,,,,,,,,,,,,,,,,,,"0","1","0","active","@CDCgov Since it’s a virus that spreads through the air, why do you not recommend n95 masks which protect against airborne?",
"true","true","my Hermes is better then yours","https://pbs.twimg.com/profile_images/2028595772653289472/5tIXPseg_normal.jpg","drizzy8423","323310623","sheeptweetZ","2870","0","1414623345291714567","Mon Jul 12 17:54:39 +0000 2021","My kids will never wear a mask sorry Brodie",,,,,,,,,,,,,,,,,,,,,,,,,,,,,,,,,,,,,,,,,,,,,,,,,,,,,,,,,,,,,,,,,,,,,,,,,,,,,,,,,,,,,,,,,,,,,,,"146569971","0","7","CDC","CDCgov",,,,,,"1414644387519385601","en","177",,,,,,,,,,,,,,,,,,,"0","1","1","active","@CDCgov My kids will never wear a mask sorry Brodie",
"false","false","","https://pbs.twimg.com/profile_images/1680666888622288898/rU8jjVjG_normal.jpg","Brooks Boettner","42300470","BrookstheUmp","505","0","1414623345291714567","Mon Jul 12 18:28:46 +0000 2021","Kinda looks like child abuse to me",,,,,,,,,,,,,,,,,,,,,,,,,,,,,,,,,,,,,,,,,,,,,,,,,,,,,,,,,,,,,,,,,,,,,,,,,,,,,,,,,,,,,,,,,,,,,,,"146569971","0","7","CDC","CDCgov",,,,,,"1414652974958366728","en","168",,,,,,,,,,,,,,,,,,,"0","1","4","active","@CDCgov Kinda looks like child abuse to me",
"false","true","Husband | Dad | Runner | Lover of History | Weather Nerd | Anti-Communist

845 ➡️ 203 ➡️ 716","https://pbs.twimg.com/profile_images/1442836700544188427/GnJ7ZEWo_normal.jpg","Brad","292069876","bradfrombuffalo","204","0","1414623345291714567","Mon Jul 12 18:09:27 +0000 2021","My child has been in daycare full time since June 2020. Several cases within the staff (all masked...) ZERO cases among the kids. Fact: KIDS DON'T SPREAD COVID.",,,,,,,,,,,,,,,,,,,,,,,,,,,,,,,,,,,,,,,,,,,,,,,,,,,,,,,,,,,,,,,,,,,,,,,,,,,,,,,,,,,,,,,,,,,,,,,"146569971","0","7","CDC","CDCgov",,,,,,"1414648110123474945","en","156",,,,,,,,,,,,,,,,,,,"1","1","8","active","@CDCgov My child has been in daycare full time since June 2020. Several cases within the staff (all masked...) ZERO cases among the kids. Fact: KIDS DON'T SPREAD COVID.",
"true","true","There's a war going on. The battlefield is the mind and the price is the soul.  -- Prince","https://pbs.twimg.com/profile_images/2012021474756829184/jsg3kVZC_normal.jpg","Patrick Savalle","21567660","patricksavalle","46105","0","1414623345291714567","Mon Jul 12 19:01:58 +0000 2021","Child abuse. You should all be put on trial for crimes against humanity. 

You will be.",,,,,,,,,,,,,,,,,,,,,,,,,,,,,,,,,,,,,,,,,,,,,,,,,,,,,,,,,,,,,,,,,,,,,,,,,,,,,,,,,,,,,,,,,,,,,,,"146569971","0","7","CDC","CDCgov",,,,,,"1414661327243681793","en","64",,,,,,,,,,,,,,,,,,,"1","0","6","active","@CDCgov Child abuse. You should all be put on trial for crimes against humanity. 

You will be.",
"false","false","Team Reality nerd, always curious. ❤️ Diversity and Imagination is what makes us Human! be nice please","https://pbs.twimg.com/profile_images/1673082917441146880/Zj4GcV6q_normal.jpg","RooRoo","1312172048593031173","KoshkaRoo","1211","0","1414623345291714567","Mon Jul 12 22:55:06 +0000 2021","This is cruelty to children. The data is clear- Covid is very low risk to them. At this point it’s security theater. Make it optional to support parents who want to make those decisions themselves. Mandates only make people angry at this point",,,,,,,,,,,,,,,,,,,,,,,,,,,,,,,,,,,,,,,,,,,,,,,,,,,,,,,,,,,,,,,,,,,,,,,,,,,,,,,,,,,,,,,,,,,,,,,"146569971","0","7","CDC","CDCgov",,,,,,"1414719996412846082","en","61",,,,,,,,,,,,,,,,,,,"0","2","3","active","@CDCgov This is cruelty to children. The data is clear- Covid is very low risk to them. At this point it’s security theater. Make it optional to support parents who want to make those decisions themselves. Mandates only make people angry at this point",
"false","false","","https://pbs.twimg.com/profile_images/1382957666687930368/_0kutGBC_normal.jpg","A.A.RON","345534249","AGWr1ght","186","0","1414623345291714567","Tue Jul 13 07:19:13 +0000 2021","Not sure what's worse, implying that children need to be vaxxed against covid19 or saying that unvaxxed children should be masked. Evil bastards.",,,,,,,,,,,,,,,,,,,,,,,,,,,,,,,,,,,,,,,,,,,,,,,,,,,,,,,,,,,,,,,,,,,,,,,,,,,,,,,,,,,,,,,,,,,,,,,"146569971","0","7","CDC","CDCgov",,,,,,"1414846862155255810","en","59",,,,,,,,,,,,,,,,,,,"0","0","4","active","@CDCgov Not sure what's worse, implying that children need to be vaxxed against covid19 or saying that unvaxxed children should be masked. Evil bastards.",
"false","false","Terug van weggeweest. Sabr. Complotanalist. Tit for tat. It’s not the eyes that are blind, but the hearts.","https://pbs.twimg.com/profile_images/1466534019890393089/Jju6G6f4_normal.jpg","Amor Fati🇵🇸🕊️","1316819317049176064","2026AmorFati","878","0","1414623345291714567","Mon Jul 12 19:24:29 +0000 2021","Pure evil.",,,,,,,,,,,,,,,,,,,,,,,,,,,,,,,,,,,,,,,,,,,,,,,,,,,,,,,,,,,,,,,,,,,,,,,,,,,,,,,,,,,,,,,,,,,,,,,"146569971","0","7","CDC","CDCgov",,,,,,"1414666993895100424","en","59",,,,,,,,,,,,,,,,,,,"0","0","2","active","@CDCgov Pure evil.",
"false","false","","https://pbs.twimg.com/profile_images/1651800228486594561/RddLQfg5_normal.jpg","36.0909° N, 115.1833° W","560873469","47AgandBlack","237","1","1414623345291714567","Mon Jul 12 16:34:44 +0000 2021","Truth Time: Is the mutated form of COVID-19 more dangerous to small children than previous forms of the virus? The rhetoric is out there but people seem to be dancing around the question. If it is more dangerous, why are we allowing states to hold in-person classes nationwide?",,,,,,,,,,,,,,,,,,,,,,,,,,,,,,,,,,,,,,,,,,,,,,,,,,,,,,,,,,,,,,,,,,,,,,,,,,,,,,,,,,,,,,,,,,,,,,,"146569971","0","7","CDC","CDCgov",,,,,,"1414624275005280262","en","50",,,,,,,,,,,,,,,,,,,"0","54","1","active","@CDCgov Truth Time: Is the mutated form of COVID-19 more dangerous to small children than previous forms of the virus? The rhetoric is out there but people seem to be dancing around the question. If it is more dangerous, why are we allowing states to hold in-person classes nationwide?",
"false","false","I ❤️ double standards in politics","https://pbs.twimg.com/profile_images/1890300225/Wheel-of-Time_normal.jpg","double standard","521869317","dubstandards","563","0","1414623345291714567","Mon Jul 12 18:19:47 +0000 2021","Not even close to WHO guidance. Leave our kids alone.",,,,,,,,,,,,,,,,,,,,,,,,,,,,,,,,,,,,,,,,,,,,,,,,,,,,,,,,,,,,,,,,,,,,,,,,,,,,,,,,,,,,,,,,,,,,,,,"146569971","0","7","CDC","CDCgov",,,,,,"1414650714333274115","en","49",,,,,,,,,,,,,,,,,,,"0","0","1","active","@CDCgov Not even close to WHO guidance. Leave our kids alone.",
"false","true","Tech literate, math enthusiast, judge.","https://pbs.twimg.com/profile_images/1409732184257269761/0ZW7emnk_normal.jpg","TechJudge","1409577428394070023","techjudge","2269","0","1414623345291714567","Mon Jul 12 18:30:47 +0000 2021","Continuing this nonsense this increase anxiety and depression, close more schools, and hinder learning. These effects will be most pronounced in poor and minority children. 

Thr CDV had a year and it failed. Perhaps try something else.",,,,,,,,,,,,,,,,,,,,,,,,,,,,,,,,,,,,,,,,,,,,,,,,,,,,,,,,,,,,,,,,,,,,,,,,,,,,,,,,,,,,,,,,,,,,,,,"146569971","0","7","CDC","CDCgov",,,,,,"1414653480032210944","en","44",,,,,,,,,,,,,,,,,,,"0","2","1","active","@CDCgov Continuing this nonsense this increase anxiety and depression, close more schools, and hinder learning. These effects will be most pronounced in poor and minority children. 

Thr CDV had a year and it failed. Perhaps try something else.",
"false","false","Welcome to the Truman show
🔴Afc","https://pbs.twimg.com/profile_images/1127262674872614918/TIsRFfUw_normal.jpg","Matt b","248914770","Matty_B_Real","228","0","1414623345291714567","Mon Jul 12 22:50:28 +0000 2021","Children breath in 6 times more Co2 while wearing mask. This advice is ridiculous and dangerous",,,,,,,,,,,,,,,,,,,,,,,,,,,,,,,,,,,,,,,,,,,,,,,,,,,,,,,,,,,,,,,,,,,,,,,,,,,,,,,,,,,,,,,,,,,,,,,"146569971","0","7","CDC","CDCgov",,,,,,"1414718831210213378","en","40",,,,,,,,,,,,,,,,,,,"0","0","2","active","@CDCgov Children breath in 6 times more Co2 while wearing mask. This advice is ridiculous and dangerous",
"false","false","PhD. Theoretical Chemistry, Cornell University. 
                 The society against the slow boiling of frogs - founder.","https://pbs.twimg.com/profile_images/1727944687858712576/H0WKpgVs_normal.jpg","Boaz Ilan","33182638","zaobi","114","0","1414623345291714567","Mon Jul 12 19:44:10 +0000 2021","how horrible to coerce 2 &amp; older to enhance CO2 concentration by factor of 6. For nothing.",,,,,,,,,,,,,,,,,,,,,,,,,,,,,,,,,,,,,,,,,,,,,,,,,,,,,,,,,,,,,,,,,,,,,,,,,,,,,,,,,,,,,,,,,,,,,,,"146569971","0","7","CDC","CDCgov",,,,,,"1414671948781600768","en","37",,,,,,,,,,,,,,,,,,,"0","1","2","active","@CDCgov how horrible to coerce 2 &amp; older to enhance CO2 concentration by factor of 6. For nothing.",
"false","false","Semi-enlightened. I finally realized that social media can be as bad as driving. In West Lower Canada born/raised on the ice rink where I spend most of my days.","https://pbs.twimg.com/profile_images/2419522020/image_normal.jpg","Gary Brault","98014662","Garibaldi72","56","1","1414623345291714567","Tue Jul 13 11:27:02 +0000 2021","“People should not be walking around with masks. When you’re in the middle of an outbreak, wearing a mask might make people feel a little bit better and it might even block a droplet but it’s not providing the perfect protection that people think it is.” Tony Fauci",,,,,,,,,,,,,,,,,,,,,,,,,,,,,,,,,,,,,,,,,,,,,,,,,,,,,,,,,,,,,,,,,,,,,,,,,,,,,,,,,,,,,,,,,,,,,,,"146569971","0","7","CDC","CDCgov",,,,,,"1414909227747917837","en","20",,,,,,,,,,,,,,,,,,,"0","1","3","active","@CDCgov “People should not be walking around with masks. When you’re in the middle of an outbreak, wearing a mask might make people feel a little bit better and it might even block a droplet but it’s not providing the perfect protection that people think it is.” Tony Fauci",
"false","false","","https://pbs.twimg.com/profile_images/785350564355932160/lW0FvmL9_normal.jpg","MadDutchMan","282542724","Broekm","268","0","1414623345291714567","Mon Jul 12 16:41:00 +0000 2021","This is also still good advice for anyone who is already vaccinated. Esp. Crowed indoor spaces or spaces with lack of adequate ventilation.",,,,,,,,,,,,,,,,,,,,,,,,,,,,,,,,,,,,,,,,,,,,,,,,,,,,,,,,,,,,,,,,,,,,,,,,,,,,,,,,,,,,,,,,,,,,,,,"146569971","0","7","CDC","CDCgov",,,,,,"1414625851602214913","en","25",,,,,,,,,,,,,,,,,,,"0","28","0","active","@CDCgov This is also still good advice for anyone who is already vaccinated. Esp. Crowed indoor spaces or spaces with lack of adequate ventilation.",
"false","false","Free market anarchist, gender critical. INFJ
Loathe the govts of China and Israel, love their people. Zionism is anti-Semitism
No mask. No vax. No test. No Fear","https://pbs.twimg.com/profile_images/1414947705613324296/d5juXxlb_normal.jpg","Aisa Wood 🌸 Become #Ungovernable","1164446257","Aisa_Wood","289","0","1414623345291714567","Tue Jul 13 15:39:32 +0000 2021","I remember when Munchausen by proxy was abuse. Before it became government policy I mean.",,,,,,,,,,,,,,,,,,,,,,,,,,,,,,,,,,,,,,,,,,,,,,,,,,,,,,,,,,,,,,,,,,,,,,,,,,,,,,,,,,,,,,,,,,,,,,,"146569971","0","7","CDC","CDCgov",,,,,,"1414972772019748865","en","20",,,,,,,,,,,,,,,,,,,"0","0","1","active","@CDCgov I remember when Munchausen by proxy was abuse. Before it became government policy I mean.",
"false","false","","https://pbs.twimg.com/profile_images/831174381728575488/h8qknO9q_normal.jpg","Shelly","2480757588","ShellyB0918","386","0","1414623345291714567","Mon Jul 12 16:51:39 +0000 2021","So if you can't get the vaccine because you are too young or you are Immunocompromised then the masks DO work; but if you can get the vaccine and choose not  to get one for your own personal reasons then the masks DON'T work? Am I getting this right?",,,,,,,,,,,,,,,,,,,,,,,,,,,,,,,,,,,,,,,,,,,,,,,,,,,,,,,,,,,,,,,,,,,,,,,,,,,,,,,,,,,,,,,,,,,,,,,"146569971","0","7","CDC","CDCgov",,,,,,"1414628531481595911","en","14",,,,,,,,,,,,,,,,,,,"0","2","2","active","@CDCgov So if you can't get the vaccine because you are too young or you are Immunocompromised then the masks DO work; but if you can get the vaccine and choose not  to get one for your own personal reasons then the masks DON'T work? Am I getting this right?",
"false","false","Free the kids. Team Reality. Mama bear.","https://pbs.twimg.com/profile_images/1314059673717350400/1txldBlz_normal.jpg","cali_dreamer","1272050391111221248","calipalmtrees10","171","0","1414623345291714567","Tue Jul 13 05:27:26 +0000 2021","This is sick. You are sick. It's like the @CDCgov wakes up each morning wondering how much more they can embarrass themselves today?",,,,,,,,,,,,,,,,,,,,,,,,,,,,,,,,,,,,,,,,,,,,,,,,,,,,,,,,,,,,,,,,,,,,,,,,,,,,,,,,,,,,,,,,,,,,,,,"146569971","0","7","CDC","CDCgov","146569971","50","57","CDC","CDCgov","1414818733193715712","en","17",,,,,,,,,,,,,,,,,,,"0","0","0","active","@CDCgov This is sick. You are sick. It's like the @CDCgov wakes up each morning wondering how much more they can embarrass themselves today?",
"false","false","#BlueCrew #GetVaccinated 🌊 #RoeRoeRoeYourVote","https://pbs.twimg.com/profile_images/1498044499767054337/jLsmkpOO_normal.jpg","mMouse 🇺🇦 🌻","520128907","MouseEars4950","399","0","1414623345291714567","Tue Jul 13 04:23:08 +0000 2021","We should ALL be wearing masks again with the highly contagious #DeltaVariant running rampant.","72","85","DeltaVariant",,,,,,,,,,,,,,,,,,,,,,,,,,,,,,,,,,,,,,,,,,,,,,,,,,,,,,,,,,,,,,,,,,,,,,,,,,,,,,,,,,,,,,,,,,,,"146569971","0","7","CDC","CDCgov",,,,,,"1414802550478446600","en","15",,,,,,,,,,,,,,,,,,,"1","49","1","active","@CDCgov We should ALL be wearing masks again with the highly contagious #DeltaVariant running rampant.",
"false","false","#Bitcoin / All things are difficult before they are easy / 👨‍👩‍👧","https://pbs.twimg.com/profile_images/1621973345062240256/2MelcDao_normal.jpg","Phantik","1373002297073152001","FcpCrypto","222","0","1414623345291714567","Tue Jul 13 10:56:58 +0000 2021","Dear Parents,

We adults can understand the motives, but children cannot.

It's all about money, not health.
💰Follow the Money💰

If you are a responsible parent, never let your children run around in a mask again. 

Let it be a child🙏",,,,,,,,,,,,,,,,,,,,,,,,,,,,,,,,,,,,,,,,,,,,,,,,,,,,,,,,,,,,,,,,,,,,,,,,,,,,,,,,,,,,,,,,,,,,,,,"146569971","0","7","CDC","CDCgov",,,,,,"1414901661064122370","en","13",,,,,,,,,,,,,,,,,,,"0","0","1","active","@CDCgov Dear Parents,

We adults can understand the motives, but children cannot.

It's all about money, not health.
💰Follow the Money💰

If you are a responsible parent, never let your children run around in a mask again. 

Let it be a child🙏",
