"true","false","Cooking, gardening, foraging, game protein. Localism. Post political. Solar cycles, not CO2. Objective reality exists. Ukrainian Greek Catholic.","https://pbs.twimg.com/profile_images/1832971171408580608/5Qbo5YGs_normal.jpg","Bonnie 🇺🇦","518131160","ForagingForever","1059","0","1414623345291714567","Tue Jul 13 03:34:18 +0000 2021","Child abuse.",,,,,,,,,,,,,,,,,,,,,,,,,,,,,,,,,,,,,,,,,,,,,,,,,,,,,,,,,,,,,,,,,,,,,,,,,,,,,,,,,,,,,,,,,,,,,,,"146569971","0","7","CDC","CDCgov",,,,,,"1414790262178582531","en","14",,,,,,,,,,,,,,,,,,,"0","0","0","active","@CDCgov Child abuse.",
"false","false","Sharon Roberts is an Astanga yoga student and teacher and is trained in Shamanic healing modalities. Available online or in person.See website for full details.","https://pbs.twimg.com/profile_images/911213745136898048/owDJE6Ej_normal.jpg","Astanga Yoga Dundee","1747063435","YogaDundee","276","0","1414623345291714567","Tue Jul 13 07:53:29 +0000 2021","Is that because restricting breathing for children (and adults) is a safe and natural thing?  How about improving nutrition, exercise, time in nature and breathing full fresh air? Might that reduce dis-ease?",,,,,,,,,,,,,,,,,,,,,,,,,,,,,,,,,,,,,,,,,,,,,,,,,,,,,,,,,,,,,,,,,,,,,,,,,,,,,,,,,,,,,,,,,,,,,,,"146569971","0","7","CDC","CDCgov",,,,,,"1414855485472350208","en","13",,,,,,,,,,,,,,,,,,,"0","0","0","active","@CDCgov Is that because restricting breathing for children (and adults) is a safe and natural thing?  How about improving nutrition, exercise, time in nature and breathing full fresh air? Might that reduce dis-ease?",
"false","false","זוכרת את השואה כדי שלא תחזור, זוכרת את הונאת הקורונה מאותה סיבה","https://pbs.twimg.com/profile_images/1958201765112778754/giBoamUY_normal.jpg","יעל בן דב גולדברג","1253569651528916992","YaelBenDovGold","1959","0","1414623345291714567","Mon Jul 12 20:37:13 +0000 2021","Criminals",,,,,,,,,,,,,,,,,,,,,,,,,,,,,,,,,,,,,,,,,,,,,,,,,,,,,,,,,,,,,,,,,,,,,,,,,,,,,,,,,,,,,,,,,,,,,,,"146569971","0","7","CDC","CDCgov",,,,,,"1414685297032540170","ca","12",,,,,,,,,,,,,,,,,,,"0","0","0","active","@CDCgov Criminals",
"false","false","","https://abs.twimg.com/sticky/default_profile_images/default_profile_normal.png","GeorgianB_03","1068333423155130369","GeorgeOnTheBay","30","0","1414623345291714567","Mon Jul 12 18:39:48 +0000 2021","🖕🏿",,,,,,,,,,,,,,,,,,,,,,,,,,,,,,,,,,,,,,,,,,,,,,,,,,,,,,,,,,,,,,,,,,,,,,,,,,,,,,,,,,,,,,,,,,,,,,,"146569971","0","7","CDC","CDCgov",,,,,,"1414655751944085505","qme","9",,,,,,,,,,,,,,,,,,,"0","0","0","active","@CDCgov 🖕🏿",
"false","false","So you want to run a purity-test based society? Cool. Are you perfect? No? Start there.","https://pbs.twimg.com/profile_images/1613662024122404864/35aDq-P7_normal.jpg","Perspicuous","153994927","chaos_sonata","2042","0","1414623345291714567","Tue Jul 13 15:40:35 +0000 2021","Protecting them from what exactly? “Compared with adults, children and adolescents who are infected with SARS-CoV-2 are more commonly asymptomatic (never develop symptoms) or have mild, non-specific symptoms (e.g. headache, sore throat”",,,,,,,,,,,,,,,,,,,,,,,,,,,,,,,,,,,,,,,,,,,,,,,,,,,,,,,,,,,,,,,,,,,,,,,,,,,,,,,,,,,,,,,,,,,,,,,"146569971","0","7","CDC","CDCgov",,,,,,"1414973035883294724","en","9",,,,,,,,,,,,,,,,,,,"1","0","0","active","@CDCgov Protecting them from what exactly? “Compared with adults, children and adolescents who are infected with SARS-CoV-2 are more commonly asymptomatic (never develop symptoms) or have mild, non-specific symptoms (e.g. headache, sore throat”",
"false","false","","https://pbs.twimg.com/profile_images/1733939315535740928/pCqHjprs_normal.jpg","M@ri@","4876602754","twwwitterrrr","223","0","1414623345291714567","Mon Jul 12 22:39:56 +0000 2021","Good luck with trying to make a 2 year old keep that on whilst it's in day care!
I think all these people advising are enjoying making these rules  up.",,,,,,,,,,,,,,,,,,,,,,,,,,,,,,,,,,,,,,,,,,,,,,,,,,,,,,,,,,,,,,,,,,,,,,,,,,,,,,,,,,,,,,,,,,,,,,,"146569971","0","7","CDC","CDCgov",,,,,,"1414716180175130629","en","7",,,,,,,,,,,,,,,,,,,"0","0","1","active","@CDCgov Good luck with trying to make a 2 year old keep that on whilst it's in day care!
I think all these people advising are enjoying making these rules  up.",
"true","false","Husband, father, American patriot, truth teller. Recovering NYC banker. Living in the free state of Florida. Bi-continental.","https://pbs.twimg.com/profile_images/1865541996858814464/NypMGRyM_normal.jpg","Russ Protti","980978124425977856","russ_protti","90","0","1414623345291714567","Tue Jul 13 07:56:47 +0000 2021","Please show us the science that supports a 2 year old wearing a fitted mask.",,,,,,,,,,,,,,,,,,,,,,,,,,,,,,,,,,,,,,,,,,,,,,,,,,,,,,,,,,,,,,,,,,,,,,,,,,,,,,,,,,,,,,,,,,,,,,,"146569971","0","7","CDC","CDCgov",,,,,,"1414856317412519937","en","8",,,,,,,,,,,,,,,,,,,"0","0","0","active","@CDCgov Please show us the science that supports a 2 year old wearing a fitted mask.",
"true","false","»Nichts ist schwerer …, als sich in offenem Gegensatz zu seiner Zeit zu befinden und laut zu sagen Nein«","https://pbs.twimg.com/profile_images/1607784080904421376/zEoRVF2M_normal.jpg","spasskultur","67412123","spasskultur","14183","0","1414623345291714567","Tue Jul 13 10:54:49 +0000 2021","kinder am atmen hindern ist kriminell",,,,,,,,,,,,,,,,,,,,,,,,,,,,,,,,,,,,,,,,,,,,,,,,,,,,,,,,,,,,,,,,,,,,,,,,,,,,,,,,,,,,,,,,,,,,,,,"146569971","0","7","CDC","CDCgov",,,,,,"1414901119655059461","de","8",,,,,,,,,,,,,,,,,,,"0","0","0","active","@CDCgov kinder am atmen hindern ist kriminell",
"true","false","Gratitude, health equity, lifestyle medicine, mind body medicine, ski, SUP, tennis, yoga. MAHA","https://pbs.twimg.com/profile_images/452789437697511424/g3M_NrM0_normal.jpeg","Cindy Smith","35226467","cind1","510","0","1414623345291714567","Mon Jul 12 21:55:54 +0000 2021","Please acknowledge natural immunity!!",,,,,,,,,,,,,,,,,,,,,,,,,,,,,,,,,,,,,,,,,,,,,,,,,,,,,,,,,,,,,,,,,,,,,,,,,,,,,,,,,,,,,,,,,,,,,,,"146569971","0","7","CDC","CDCgov",,,,,,"1414705100824596517","en","8",,,,,,,,,,,,,,,,,,,"0","0","0","active","@CDCgov Please acknowledge natural immunity!!",
"false","false","🇮🇱🇮🇱🇮🇱
Business analyst/ ERP project manager. Painter. Mother. Nature and art lover. Free spirit person.","https://pbs.twimg.com/profile_images/1412772549306560517/AxWRUqqa_normal.jpg","Lena_Tozik","1411900077812207621","LenaT63765904","211","0","1414623345291714567","Tue Jul 13 14:45:24 +0000 2021","Children's immune system is developing by exposures to viruses. This virus is not dangerous to children. The natural immunity is much better than vax. Ask Israeli ministry of health. They just discovered it.",,,,,,,,,,,,,,,,,,,,,,,,,,,,,,,,,,,,,,,,,,,,,,,,,,,,,,,,,,,,,,,,,,,,,,,,,,,,,,,,,,,,,,,,,,,,,,,"146569971","0","7","CDC","CDCgov",,,,,,"1414959150040297472","en","8",,,,,,,,,,,,,,,,,,,"0","0","0","active","@CDCgov Children's immune system is developing by exposures to viruses. This virus is not dangerous to children. The natural immunity is much better than vax. Ask Israeli ministry of health. They just discovered it.",
"false","false","Rechts conservatief, pro-life/Tegen multilateralisme;“You will own nothing and be happy” Anti-Communist&Anti-Fascist. Bewust ongevaccineerd tegen Corona.","https://pbs.twimg.com/profile_images/1469314437148463109/OhYboF8b_normal.jpg","CorneliusFVD","280128882","CorneliusFVD","1994","0","1414623345291714567","Mon Jul 12 21:19:00 +0000 2021","This is so wrong, on so many levels",,,,,,,,,,,,,,,,,,,,,,,,,,,,,,,,,,,,,,,,,,,,,,,,,,,,,,,,,,,,,,,,,,,,,,,,,,,,,,,,,,,,,,,,,,,,,,,"146569971","0","7","CDC","CDCgov",,,,,,"1414695814287536141","en","7",,,,,,,,,,,,,,,,,,,"0","0","0","active","@CDCgov This is so wrong, on so many levels",
"false","false","מדע, טכנולוגיה, פוליטיקה, אוכל, ספורט, ים.","https://pbs.twimg.com/profile_images/1663201433351536641/jKSl2csj_normal.jpg","Yossi Shaul","2889049769","y1shaul","1578","0","1414623345291714567","Tue Jul 13 13:20:46 +0000 2021","Covering the face of toddlers as if they were harmful as Hannibal Lecter, is pure child abuse, not less.",,,,,,,,,,,,,,,,,,,,,,,,,,,,,,,,,,,,,,,,,,,,,,,,,,,,,,,,,,,,,,,,,,,,,,,,,,,,,,,,,,,,,,,,,,,,,,,"146569971","0","7","CDC","CDCgov",,,,,,"1414937851200954374","en","7",,,,,,,,,,,,,,,,,,,"0","0","0","active","@CDCgov Covering the face of toddlers as if they were harmful as Hannibal Lecter, is pure child abuse, not less.",
"false","true","I identify as a green-eyed red head; don’t tell me I’m a brown-eyed brunette. My dye and contacts say otherwise, hater. 💛 I also knit and embroider. 💍’ed","https://pbs.twimg.com/profile_images/1511183430129790979/jlJWIRwL_normal.jpg","Ghost Feet ن AKA Iron Lady 🧡","197558841","Just_Here_4Food","1333","0","1414623345291714567","Tue Jul 13 06:58:35 +0000 2021","",,,,,,,"pic.x.com/ybuuNQTMyn","https://x.com/Just_Here_4Food/status/1414841669745352709/photo/1",,"Available",,,,,,,,,,,,,,,,,,,,,,,,,,,,,,,,,"1414841663076409344","8","31","16_1414841663076409344","16_1414841663076409344","https://pbs.twimg.com/tweet_video_thumb/E6KG_xUXoAA-L2X.jpg",,,,,,,,,,,,,,,,,,,,,"274","400","274","fit","400","274","fit","400","274","fit","400","150","crop","150","animated_gif","https://t.co/ybuuNQTMyn","200","137","0","video/mp4","https://video.twimg.com/tweet_video/E6KG_xUXoAA-L2X.mp4",,,,,,"146569971","0","7","CDC","CDCgov",,,,,,"1414841669745352709","qme","7",,,"200","137",,"1414841663076409344","https://pbs.twimg.com/tweet_video_thumb/E6KG_xUXoAA-L2X.jpg","274","400","0","video/mp4","https://video.twimg.com/tweet_video/E6KG_xUXoAA-L2X.mp4",,,,,,,"0","0","0","active","@CDCgov https://t.co/ybuuNQTMyn",
"false","false","","https://pbs.twimg.com/profile_images/1815449278988644354/mqaBD-kQ_normal.jpg","Lorraine Harvey","852708006345162752","LorraineHarvey_","3494","0","1414623345291714567","Tue Jul 13 02:46:29 +0000 2021","This is child abuse.",,,,,,,,,,,,,,,,,,,,,,,,,,,,,,,,,,,,,,,,,,,,,,,,,,,,,,,,,,,,,,,,,,,,,,,,,,,,,,,,,,,,,,,,,,,,,,,"146569971","0","7","CDC","CDCgov",,,,,,"1414778225901793282","en","6",,,,,,,,,,,,,,,,,,,"0","0","0","active","@CDCgov This is child abuse.",
"true","true","","https://pbs.twimg.com/profile_images/1296009061109043200/8wwWHhgE_normal.jpg","Mario_Acciaio","1296006171862667264","AcciaioMario","6039","0","1414623345291714567","Tue Jul 13 20:09:55 +0000 2021","You are a bunch of SATANIC CRIMINAL.",,,,,,,,,,,,,,,,,,,,,,,,,,,,,,,,,,,,,,,,,,,,,,,,,,,,,,,,,,,,,,,,,,,,,,,,,,,,,,,,,,,,,,,,,,,,,,,"146569971","0","7","CDC","CDCgov",,,,,,"1415040818457583617","en","4",,,,,,,,,,,,,,,,,,,"0","0","1","active","@CDCgov You are a bunch of SATANIC CRIMINAL.",
"false","true","BA in History;
MA in Emergency and Crisis Management;
Floridian","https://pbs.twimg.com/profile_images/1366902178460413952/1GYybaHF_normal.jpg","H43","2741540193","H486572676574","706","0","1414623345291714567","Mon Jul 12 16:41:55 +0000 2021","Once they show signs of sickness, you're about 2 to 3 days late from stopping the spread.",,,,,,,,,,,,,,,,,,,,,,,,,,,,,,,,,,,,,,,,,,,,,,,,,,,,,,,,,,,,,,,,,,,,,,,,,,,,,,,,,,,,,,,,,,,,,,,"146569971","0","7","CDC","CDCgov",,,,,,"1414626083694161920","en","6",,,,,,,,,,,,,,,,,,,"0","2","0","active","@CDCgov Once they show signs of sickness, you're about 2 to 3 days late from stopping the spread.",
"false","false","Never avoid being wrong to the point where you cling to ignorance.
Realizing you're wrong means you learned something new, that's all.
Embrace it.","https://pbs.twimg.com/profile_images/2060506317240877058/PU4iMp0__normal.jpg","India Yankee Kilo Yankee Kilo","718426119951753216","xenn1al","2277","0","1414623345291714567","Mon Jul 12 16:33:28 +0000 2021","Now watch people get upset about this announcement when it's the same thing daycare facilities ask of parents anyway and was already a common request pre-COVID.

Gotta stay mad about something, right?",,,,,,,"pic.x.com/ScNrP38vZW","https://x.com/Observat1onist/status/1414623956838096902/photo/1","Lmao Lol GIF by Originals","Available",,,,,,,,,,,,,,,,,,,,,,,,,,,,,,,,,"1414623945404387329","209","232","16_1414623945404387329","16_1414623945404387329","https://pbs.twimg.com/tweet_video_thumb/E6HA-7yXEAEXO3N.jpg",,,,,,,,,,,,,,,,,,,,,"480","410","480","fit","410","480","fit","410","480","fit","410","150","crop","150","animated_gif","https://t.co/ScNrP38vZW","41","48","0","video/mp4","https://video.twimg.com/tweet_video/E6HA-7yXEAEXO3N.mp4",,,,,,"146569971","0","7","CDC","CDCgov",,,,,,"1414623956838096902","en","6",,,"41","48",,"1414623945404387329","https://pbs.twimg.com/tweet_video_thumb/E6HA-7yXEAEXO3N.jpg","480","410","0","video/mp4","https://video.twimg.com/tweet_video/E6HA-7yXEAEXO3N.mp4",,,,,,,"0","37","0","active","@CDCgov Now watch people get upset about this announcement when it's the same thing daycare facilities ask of parents anyway and was already a common request pre-COVID.

Gotta stay mad about something, right? https://t.co/ScNrP38vZW",
"true","true","Electro-Voice RE20 microphone repairs and foam kits. 

Art Bell, Rush Limbaugh, Paul Harvey, Charlie Kirk all used RE20s

https://t.co/FHOGWNtiXZ","https://pbs.twimg.com/profile_images/1714796376146550784/g8wHBFjG_normal.jpg","micdaddy","3553198514","LincolnMics","2466","0","1414623345291714567","Mon Jul 12 18:43:18 +0000 2021","total nonsense 
what do you say to all the daycares that have not worn masks for months with no fallout? explain it",,,,,,,,,,,,,,,,,,,,,,,,,,,,,,,,,,,,,,,,,,,,,,,,,,,,,,,,,,,,,,,,,,,,,,,,,,,,,,,,,,,,,,,,,,,,,,,"146569971","0","7","CDC","CDCgov",,,,,,"1414656632311668746","en","6",,,,,,,,,,,,,,,,,,,"0","0","0","active","@CDCgov total nonsense 
what do you say to all the daycares that have not worn masks for months with no fallout? explain it",
"false","false","Enterpreneur | Digital solutions | Agripreneur","https://pbs.twimg.com/profile_images/993405149510033408/PE3tRI2f_normal.jpg","Tony Asukile","993403533805449216","AsukileTony","74","0","1414623345291714567","Tue Jul 13 02:45:53 +0000 2021","The devil himself is running @CDCgov. This is the evidence.",,,,,,,,,,,,,,,,,,,,,,,,,,,,,,,,,,,,,,,,,,,,,,,,,,,,,,,,,,,,,,,,,,,,,,,,,,,,,,,,,,,,,,,,,,,,,,,"146569971","0","7","CDC","CDCgov","146569971","37","44","CDC","CDCgov","1414778077238939648","en","6",,,,,,,,,,,,,,,,,,,"0","0","0","active","@CDCgov The devil himself is running @CDCgov. This is the evidence.",
"false","false","research analyst molecular biology","https://pbs.twimg.com/profile_images/1697479896300142592/B-HGO2uW_normal.jpg","Analisttotinmijnkist","1202267089739898881","Analistener11","792","0","1414623345291714567","Mon Jul 12 22:36:16 +0000 2021","I cannot believe my eyes!",,,,,,,,,,,,,,,,,,,,,,,,,,,,,,,,,,,,,,,,,,,,,,,,,,,,,,,,,,,,,,,,,,,,,,,,,,,,,,,,,,,,,,,,,,,,,,,"146569971","0","7","CDC","CDCgov",,,,,,"1414715258544001025","en","6",,,,,,,,,,,,,,,,,,,"0","0","0","active","@CDCgov I cannot believe my eyes!",
"false","false","","https://pbs.twimg.com/profile_images/1492573920/Color_normal.jpg","Donald Blake","119999806","StatisPro","67","0","1414623345291714567","Tue Jul 13 03:53:59 +0000 2021","This sort of messaging is beyond heinous.",,,,,,,,,,,,,,,,,,,,,,,,,,,,,,,,,,,,,,,,,,,,,,,,,,,,,,,,,,,,,,,,,,,,,,,,,,,,,,,,,,,,,,,,,,,,,,,"146569971","0","7","CDC","CDCgov",,,,,,"1414795213252431872","en","6",,,,,,,,,,,,,,,,,,,"0","0","0","active","@CDCgov This sort of messaging is beyond heinous.",
"true","false","","https://pbs.twimg.com/profile_images/1614821292015853569/8TAuEZiq_normal.jpg","A Man on a Fast","143678469","manonafast","184","0","1414623345291714567","Tue Jul 13 03:28:17 +0000 2021","i dont know how the people responsible for this sleep",,,,,,,,,,,,,,,,,,,,,,,,,,,,,,,,,,,,,,,,,,,,,,,,,,,,,,,,,,,,,,,,,,,,,,,,,,,,,,,,,,,,,,,,,,,,,,,"146569971","0","7","CDC","CDCgov",,,,,,"1414788746747199497","en","5",,,,,,,,,,,,,,,,,,,"0","0","0","active","@CDCgov i dont know how the people responsible for this sleep",
"true","false","Husband, father just trying to make sense of a nonsensical world.","https://pbs.twimg.com/profile_images/1518655237351002114/Q2QwVbKd_normal.jpg","Bob Kain","776151485407174657","NBBear2","652","0","1414623345291714567","Mon Jul 12 23:08:45 +0000 2021","Child abuse. Group that has no covid deaths, least susceptible to infection and most vulnerable to CO2 build up from wearing masks.  All to pacify adults that should either be vaccinated or willing to take the risk of not being vaccinated. Sure as hell isn't about protecting kids",,,,,,,,,,,,,,,,,,,,,,,,,,,,,,,,,,,,,,,,,,,,,,,,,,,,,,,,,,,,,,,,,,,,,,,,,,,,,,,,,,,,,,,,,,,,,,,"146569971","0","7","CDC","CDCgov",,,,,,"1414723433942982656","en","3",,,,,,,,,,,,,,,,,,,"0","0","1","active","@CDCgov Child abuse. Group that has no covid deaths, least susceptible to infection and most vulnerable to CO2 build up from wearing masks.  All to pacify adults that should either be vaccinated or willing to take the risk of not being vaccinated. Sure as hell isn't about protecting kids",
"false","true","Electrician, RSPCA, Dogs Trust and Battersea supporter. Love West Ham Utd, Essex County Cricket, History and Classical Music.","https://pbs.twimg.com/profile_images/1213468511286308875/anVMJdBe_normal.jpg","Graham Smith","241603378","gsmith1959","464","0","1414623345291714567","Tue Jul 13 07:33:38 +0000 2021","This is abuse, no child should ever be subjected to this draconian measure.",,,,,,,,,,,,,,,,,,,,,,,,,,,,,,,,,,,,,,,,,,,,,,,,,,,,,,,,,,,,,,,,,,,,,,,,,,,,,,,,,,,,,,,,,,,,,,,"146569971","0","7","CDC","CDCgov",,,,,,"1414850491893358592","en","5",,,,,,,,,,,,,,,,,,,"0","0","0","active","@CDCgov This is abuse, no child should ever be subjected to this draconian measure.",
"false","true","#SOSCuba     #FCKHMS
wokeness is a mental disease-
Gendern = Hirnschiss
prepare to be assimilated","https://pbs.twimg.com/profile_images/1578513413445140481/na6OnoIY_normal.jpg","potatoman","1396173901516918792","munro_sr","167","0","1414623345291714567","Tue Jul 13 09:30:20 +0000 2021","repugnant child abuse",,,,,,,,,,,,,,,,,,,,,,,,,,,,,,,,,,,,,,,,,,,,,,,,,,,,,,,,,,,,,,,,,,,,,,,,,,,,,,,,,,,,,,,,,,,,,,,"146569971","0","7","CDC","CDCgov","268416673","8","23","Laura Berrill","LauraBerrillPR","1414879860917514280","fr","5",,,,,,,,,,,,,,,,,,,"0","0","0","active","@CDCgov @LauraBerrillPR repugnant child abuse",
"false","false","Retired educator (nonunionized), love my family, hiking, camping, hunting, fishing, gardening, making wine, bee keeping, and pretending to be a homesteader.","https://pbs.twimg.com/profile_images/1186001870101401600/IQXsOyN1_normal.jpg","Lee Howell","2642447518","leehowell32","858","0","1414623345291714567","Wed Jul 14 16:31:08 +0000 2021","CDC, no credibility anymore.",,,,,,,,,,,,,,,,,,,,,,,,,,,,,,,,,,,,,,,,,,,,,,,,,,,,,,,,,,,,,,,,,,,,,,,,,,,,,,,,,,,,,,,,,,,,,,,"146569971","0","7","CDC","CDCgov",,,,,,"1415348144146194432","en","5",,,,,,,,,,,,,,,,,,,"0","0","0","active","@CDCgov CDC, no credibility anymore.",
"false","false","","https://pbs.twimg.com/profile_images/1535253386957840386/3_HImcEg_normal.jpg","rose","3302070061","rroses_3","69","0","1414623345291714567","Mon Jul 12 18:18:37 +0000 2021","No no no.",,,,,,,,,,,,,,,,,,,,,,,,,,,,,,,,,,,,,,,,,,,,,,,,,,,,,,,,,,,,,,,,,,,,,,,,,,,,,,,,,,,,,,,,,,,,,,,"146569971","0","7","CDC","CDCgov",,,,,,"1414650421122060289","es","5",,,,,,,,,,,,,,,,,,,"0","0","0","active","@CDCgov No no no.",
"false","false","#Sports; #Politics; #Nature; #Travel; #AdventureSports; Legal Immigrant; Naturalized Citizen; 🇮🇳 to 🇺🇸","https://pbs.twimg.com/profile_images/1331359425593044995/J54hjiPo_normal.jpg","SJ","710866172338577408","RoadTripnIndian","235","0","1414623345291714567","Mon Jul 12 18:22:06 +0000 2021","@CDCDirector - You all are the child abusers. Shame on you for selling your souls to political party &amp; teacher’ unions. Lost whatever trust was remaining. This happening in US is highly unfortunate. One of the most anti-kids regulatory body in the world. Disgusting. #UnMaskKids","279","290","UnMaskKids",,,,,,,,,,,,,,,,,,,,,,,,,,,,,,,,,,,,,,,,,,,,,,,,,,,,,,,,,,,,,,,,,,,,,,,,,,,,,,,,,,,,,,,,,,,,"146569971","0","7","CDC","CDCgov","426909329","8","20","CDC Director","CDCDirector","1414651297677074434","en","3",,,,,,,,,,,,,,,,,,,"0","0","1","active","@CDCgov @CDCDirector - You all are the child abusers. Shame on you for selling your souls to political party &amp; teacher’ unions. Lost whatever trust was remaining. This happening in US is highly unfortunate. One of the most anti-kids regulatory body in the world. Disgusting. #UnMaskKids",
"false","true","Teacher at Sacred Heart Elementary School","https://pbs.twimg.com/profile_images/1697726081090846721/0yjrmP1Z_normal.jpg","Mrs. Sanna","3974121673","SannaSacHeart","191","0","1414623345291714567","Tue Jul 13 21:32:46 +0000 2021","This is revolting. Please back this up with the science that supports these recommendations.",,,,,,,,,,,,,,,,,,,,,,,,,,,,,,,,,,,,,,,,,,,,,,,,,,,,,,,,,,,,,,,,,,,,,,,,,,,,,,,,,,,,,,,,,,,,,,,"146569971","0","7","CDC","CDCgov",,,,,,"1415061666341994497","en","5",,,,,,,,,,,,,,,,,,,"0","0","0","active","@CDCgov This is revolting. Please back this up with the science that supports these recommendations.",
"false","true","Art lecturer and creative person. 🇬🇧 🏴󠁧󠁢󠁷󠁬󠁳󠁿 🇮🇪 ENFP ♐ ✝️","https://pbs.twimg.com/profile_images/2064835825875992576/eOqqwenO_normal.jpg","𝙇𝙞𝙖𝙢","18476186","TribalSpaceman","2165","0","1414623345291714567","Tue Jul 13 11:00:55 +0000 2021","Fixed it for you.",,,,,,,"pic.x.com/fw8eMe2aOq","https://x.com/TribalSpaceman/status/1414902654581489667/photo/1",,"Available",,,,,,,,,,,,,,,,,,,,,,,,,,,,,,,,,"1414902631726829573","26","49","3_1414902631726829573","3_1414902631726829573","https://pbs.twimg.com/media/E6K-cnPX0AU5R17.jpg","828","1479","541","0","828","828","866","0","828","726","917","0","828","414","1073","0","828","2048","0","0","828","2048","828","fit","2048","485","fit","1200","275","fit","680","150","crop","150","photo","https://t.co/fw8eMe2aOq",,,,,,,,,,,"146569971","0","7","CDC","CDCgov",,,,,,"1414902654581489667","en","5","1414902631726829573","https://pbs.twimg.com/media/E6K-cnPX0AU5R17.jpg",,,,,,,,,,,,,,,,,"0","1","0","active","@CDCgov Fixed it for you. https://t.co/fw8eMe2aOq",
"false","true","Science & engineering, Freedom & Learning, Big Data, Photography, Public Safety, All-Source Hazards & Risk Mitigation. 
Pronouns: We/Ourses/Theirses","https://pbs.twimg.com/profile_images/1408691091277324293/_QVdB4Hs_normal.jpg","Alexander Rogge","74936528","alexanderrogge","716","0","1414623345291714567","Tue Jul 13 05:06:10 +0000 2021","If a #FaceDiaper can stop viruses safely, why didn't you tell us this sooner?  These ""child care"" facilities are cesspools, where children and employees are often coughing, sneezing, suffering fevers, and getting Pink Eye.  Which ""fitted mask"" can stop children from getting sick?","13","24","FaceDiaper",,,,,,,,,,,,,,,,,,,,,,,,,,,,,,,,,,,,,,,,,,,,,,,,,,,,,,,,,,,,,,,,,,,,,,,,,,,,,,,,,,,,,,,,,,,,"146569971","0","7","CDC","CDCgov",,,,,,"1414813378606948360","en","3",,,,,,,,,,,,,,,,,,,"0","0","1","active","@CDCgov If a #FaceDiaper can stop viruses safely, why didn't you tell us this sooner?  These ""child care"" facilities are cesspools, where children and employees are often coughing, sneezing, suffering fevers, and getting Pink Eye.  Which ""fitted mask"" can stop children from getting sick?",
"false","true","Often the best opportunities are the ones so close they are hard to see. Find them, seize them!","https://pbs.twimg.com/profile_images/1659402784/image_normal.jpg","Greg Miller","22551166","BrewGruxKing","131","0","1414623345291714567","Tue Jul 13 00:36:50 +0000 2021","How about…..no.",,,,,,,,,,,,,,,,,,,,,,,,,,,,,,,,,,,,,,,,,,,,,,,,,,,,,,,,,,,,,,,,,,,,,,,,,,,,,,,,,,,,,,,,,,,,,,,"146569971","0","7","CDC","CDCgov",,,,,,"1414745601129041920","en","4",,,,,,,,,,,,,,,,,,,"0","0","0","active","@CDCgov How about…..no.",
"false","false","Praying for a miracle.","https://pbs.twimg.com/profile_images/1054375248651407361/f1QhT7vS_normal.jpg","Hi.","720636793742163970","LA_Housewife","371","0","1414623345291714567","Mon Jul 12 18:27:12 +0000 2021","Nope.",,,,,,,,,,,,,,,,,,,,,,,,,,,,,,,,,,,,,,,,,,,,,,,,,,,,,,,,,,,,,,,,,,,,,,,,,,,,,,,,,,,,,,,,,,,,,,,"146569971","0","7","CDC","CDCgov",,,,,,"1414652577396916224","en","4",,,,,,,,,,,,,,,,,,,"0","0","0","active","@CDCgov Nope.",
"false","false","Seeing is disbelieving. #mykids #afc and test cricket 💕. Pharmacist leader.  Cat person.","https://pbs.twimg.com/profile_images/1208512255178035200/HstCIHcu_normal.jpg","Marc Nathan","880412190993416193","m4rcn4than","86","0","1414623345291714567","Tue Jul 13 07:43:34 +0000 2021","This is just covid centric evil! Clearly a child’s development and happiness and immune health can’t be sacrificed to protect the anxious adults…. Rethink",,,,,,,,,,,,,,,,,,,,,,,,,,,,,,,,,,,,,,,,,,,,,,,,,,,,,,,,,,,,,,,,,,,,,,,,,,,,,,,,,,,,,,,,,,,,,,,"146569971","0","7","CDC","CDCgov",,,,,,"1414852993409851393","en","4",,,,,,,,,,,,,,,,,,,"0","0","0","active","@CDCgov This is just covid centric evil! Clearly a child’s development and happiness and immune health can’t be sacrificed to protect the anxious adults…. Rethink",
"false","false","All views are my own","https://pbs.twimg.com/profile_images/1395450667716730886/LcpIezTd_normal.jpg","lisa benjamin","1044681653757636617","lisaben62061807","183","0","1414623345291714567","Mon Jul 12 21:31:08 +0000 2021","This is shocking!!",,,,,,,,,,,,,,,,,,,,,,,,,,,,,,,,,,,,,,,,,,,,,,,,,,,,,,,,,,,,,,,,,,,,,,,,,,,,,,,,,,,,,,,,,,,,,,,"146569971","0","7","CDC","CDCgov",,,,,,"1414698865459138565","en","4",,,,,,,,,,,,,,,,,,,"0","0","0","active","@CDCgov This is shocking!!",
