"author/blue_verified","author/can_dm","author/description","author/image","author/name","author/rest_id","author/screen_name","author/sub_count","bookmarks","conversation_id","created_at","display_text","entities/hashtags/0/indices/0","entities/hashtags/0/indices/1","entities/hashtags/0/text","entities/hashtags/1/indices/0","entities/hashtags/1/indices/1","entities/hashtags/1/text","entities/hashtags/2/indices/0","entities/hashtags/2/indices/1","entities/hashtags/2/text","entities/hashtags/3/indices/0","entities/hashtags/3/indices/1","entities/hashtags/3/text","entities/hashtags/4/indices/0","entities/hashtags/4/indices/1","entities/hashtags/4/text","entities/hashtags/5/indices/0","entities/hashtags/5/indices/1","entities/hashtags/5/text","entities/hashtags/6/indices/0","entities/hashtags/6/indices/1","entities/hashtags/6/text","entities/hashtags/7/indices/0","entities/hashtags/7/indices/1","entities/hashtags/7/text","entities/media/0/display_url","entities/media/0/expanded_url","entities/media/0/ext_alt_text","entities/media/0/ext_media_availability/status","entities/media/0/features/large/faces/0/h","entities/media/0/features/large/faces/0/w","entities/media/0/features/large/faces/0/x","entities/media/0/features/large/faces/0/y","entities/media/0/features/large/faces/1/h","entities/media/0/features/large/faces/1/w","entities/media/0/features/large/faces/1/x","entities/media/0/features/large/faces/1/y","entities/media/0/features/large/faces/2/h","entities/media/0/features/large/faces/2/w","entities/media/0/features/large/faces/2/x","entities/media/0/features/large/faces/2/y","entities/media/0/features/medium/faces/0/h","entities/media/0/features/medium/faces/0/w","entities/media/0/features/medium/faces/0/x","entities/media/0/features/medium/faces/0/y","entities/media/0/features/medium/faces/1/h","entities/media/0/features/medium/faces/1/w","entities/media/0/features/medium/faces/1/x","entities/media/0/features/medium/faces/1/y","entities/media/0/features/medium/faces/2/h","entities/media/0/features/medium/faces/2/w","entities/media/0/features/medium/faces/2/x","entities/media/0/features/medium/faces/2/y","entities/media/0/features/orig/faces/0/h","entities/media/0/features/orig/faces/0/w","entities/media/0/features/orig/faces/0/x","entities/media/0/features/orig/faces/0/y","entities/media/0/features/orig/faces/1/h","entities/media/0/features/orig/faces/1/w","entities/media/0/features/orig/faces/1/x","entities/media/0/features/orig/faces/1/y","entities/media/0/features/orig/faces/2/h","entities/media/0/features/orig/faces/2/w","entities/media/0/features/orig/faces/2/x","entities/media/0/features/orig/faces/2/y","entities/media/0/features/small/faces/0/h","entities/media/0/features/small/faces/0/w","entities/media/0/features/small/faces/0/x","entities/media/0/features/small/faces/0/y","entities/media/0/features/small/faces/1/h","entities/media/0/features/small/faces/1/w","entities/media/0/features/small/faces/1/x","entities/media/0/features/small/faces/1/y","entities/media/0/features/small/faces/2/h","entities/media/0/features/small/faces/2/w","entities/media/0/features/small/faces/2/x","entities/media/0/features/small/faces/2/y","entities/media/0/id_str","entities/media/0/indices/0","entities/media/0/indices/1","entities/media/0/media_key","entities/media/0/media_results/result/media_key","entities/media/0/media_url_https","entities/media/0/original_info/focus_rects/0/h","entities/media/0/original_info/focus_rects/0/w","entities/media/0/original_info/focus_rects/0/x","entities/media/0/original_info/focus_rects/0/y","entities/media/0/original_info/focus_rects/1/h","entities/media/0/original_info/focus_rects/1/w","entities/media/0/original_info/focus_rects/1/x","entities/media/0/original_info/focus_rects/1/y","entities/media/0/original_info/focus_rects/2/h","entities/media/0/original_info/focus_rects/2/w","entities/media/0/original_info/focus_rects/2/x","entities/media/0/original_info/focus_rects/2/y","entities/media/0/original_info/focus_rects/3/h","entities/media/0/original_info/focus_rects/3/w","entities/media/0/original_info/focus_rects/3/x","entities/media/0/original_info/focus_rects/3/y","entities/media/0/original_info/focus_rects/4/h","entities/media/0/original_info/focus_rects/4/w","entities/media/0/original_info/focus_rects/4/x","entities/media/0/original_info/focus_rects/4/y","entities/media/0/original_info/height","entities/media/0/original_info/width","entities/media/0/sizes/large/h","entities/media/0/sizes/large/resize","entities/media/0/sizes/large/w","entities/media/0/sizes/medium/h","entities/media/0/sizes/medium/resize","entities/media/0/sizes/medium/w","entities/media/0/sizes/small/h","entities/media/0/sizes/small/resize","entities/media/0/sizes/small/w","entities/media/0/sizes/thumb/h","entities/media/0/sizes/thumb/resize","entities/media/0/sizes/thumb/w","entities/media/0/type","entities/media/0/url","entities/media/0/video_info/aspect_ratio/0","entities/media/0/video_info/aspect_ratio/1","entities/media/0/video_info/variants/0/bitrate","entities/media/0/video_info/variants/0/content_type","entities/media/0/video_info/variants/0/url","entities/media/1/display_url","entities/media/1/expanded_url","entities/media/1/ext_alt_text","entities/media/1/ext_media_availability/status","entities/media/1/features/large/faces/0/h","entities/media/1/features/large/faces/0/w","entities/media/1/features/large/faces/0/x","entities/media/1/features/large/faces/0/y","entities/media/1/features/large/faces/1/h","entities/media/1/features/large/faces/1/w","entities/media/1/features/large/faces/1/x","entities/media/1/features/large/faces/1/y","entities/media/1/features/large/faces/2/h","entities/media/1/features/large/faces/2/w","entities/media/1/features/large/faces/2/x","entities/media/1/features/large/faces/2/y","entities/media/1/features/medium/faces/0/h","entities/media/1/features/medium/faces/0/w","entities/media/1/features/medium/faces/0/x","entities/media/1/features/medium/faces/0/y","entities/media/1/features/medium/faces/1/h","entities/media/1/features/medium/faces/1/w","entities/media/1/features/medium/faces/1/x","entities/media/1/features/medium/faces/1/y","entities/media/1/features/medium/faces/2/h","entities/media/1/features/medium/faces/2/w","entities/media/1/features/medium/faces/2/x","entities/media/1/features/medium/faces/2/y","entities/media/1/features/orig/faces/0/h","entities/media/1/features/orig/faces/0/w","entities/media/1/features/orig/faces/0/x","entities/media/1/features/orig/faces/0/y","entities/media/1/features/orig/faces/1/h","entities/media/1/features/orig/faces/1/w","entities/media/1/features/orig/faces/1/x","entities/media/1/features/orig/faces/1/y","entities/media/1/features/orig/faces/2/h","entities/media/1/features/orig/faces/2/w","entities/media/1/features/orig/faces/2/x","entities/media/1/features/orig/faces/2/y","entities/media/1/features/small/faces/0/h","entities/media/1/features/small/faces/0/w","entities/media/1/features/small/faces/0/x","entities/media/1/features/small/faces/0/y","entities/media/1/features/small/faces/1/h","entities/media/1/features/small/faces/1/w","entities/media/1/features/small/faces/1/x","entities/media/1/features/small/faces/1/y","entities/media/1/features/small/faces/2/h","entities/media/1/features/small/faces/2/w","entities/media/1/features/small/faces/2/x","entities/media/1/features/small/faces/2/y","entities/media/1/id_str","entities/media/1/indices/0","entities/media/1/indices/1","entities/media/1/media_key","entities/media/1/media_results/result/media_key","entities/media/1/media_url_https","entities/media/1/original_info/focus_rects/0/h","entities/media/1/original_info/focus_rects/0/w","entities/media/1/original_info/focus_rects/0/x","entities/media/1/original_info/focus_rects/0/y","entities/media/1/original_info/focus_rects/1/h","entities/media/1/original_info/focus_rects/1/w","entities/media/1/original_info/focus_rects/1/x","entities/media/1/original_info/focus_rects/1/y","entities/media/1/original_info/focus_rects/2/h","entities/media/1/original_info/focus_rects/2/w","entities/media/1/original_info/focus_rects/2/x","entities/media/1/original_info/focus_rects/2/y","entities/media/1/original_info/focus_rects/3/h","entities/media/1/original_info/focus_rects/3/w","entities/media/1/original_info/focus_rects/3/x","entities/media/1/original_info/focus_rects/3/y","entities/media/1/original_info/focus_rects/4/h","entities/media/1/original_info/focus_rects/4/w","entities/media/1/original_info/focus_rects/4/x","entities/media/1/original_info/focus_rects/4/y","entities/media/1/original_info/height","entities/media/1/original_info/width","entities/media/1/sizes/large/h","entities/media/1/sizes/large/resize","entities/media/1/sizes/large/w","entities/media/1/sizes/medium/h","entities/media/1/sizes/medium/resize","entities/media/1/sizes/medium/w","entities/media/1/sizes/small/h","entities/media/1/sizes/small/resize","entities/media/1/sizes/small/w","entities/media/1/sizes/thumb/h","entities/media/1/sizes/thumb/resize","entities/media/1/sizes/thumb/w","entities/media/1/type","entities/media/1/url","entities/media/1/video_info/aspect_ratio/0","entities/media/1/video_info/aspect_ratio/1","entities/media/1/video_info/variants/0/bitrate","entities/media/1/video_info/variants/0/content_type","entities/media/1/video_info/variants/0/url","entities/urls/0/display_url","entities/urls/0/expanded_url","entities/urls/0/indices/0","entities/urls/0/indices/1","entities/urls/0/url","entities/user_mentions/0/id_str","entities/user_mentions/0/indices/0","entities/user_mentions/0/indices/1","entities/user_mentions/0/name","entities/user_mentions/0/screen_name","entities/user_mentions/1/id_str","entities/user_mentions/1/indices/0","entities/user_mentions/1/indices/1","entities/user_mentions/1/name","entities/user_mentions/1/screen_name","entities/user_mentions/2/id_str","entities/user_mentions/2/indices/0","entities/user_mentions/2/indices/1","entities/user_mentions/2/name","entities/user_mentions/2/screen_name","entities/user_mentions/3/id_str","entities/user_mentions/3/indices/0","entities/user_mentions/3/indices/1","entities/user_mentions/3/name","entities/user_mentions/3/screen_name","entities/user_mentions/4/id_str","entities/user_mentions/4/indices/0","entities/user_mentions/4/indices/1","entities/user_mentions/4/name","entities/user_mentions/4/screen_name","entities/user_mentions/5/id_str","entities/user_mentions/5/indices/0","entities/user_mentions/5/indices/1","entities/user_mentions/5/name","entities/user_mentions/5/screen_name","entities/user_mentions/6/id_str","entities/user_mentions/6/indices/0","entities/user_mentions/6/indices/1","entities/user_mentions/6/name","entities/user_mentions/6/screen_name","entities/user_mentions/7/id_str","entities/user_mentions/7/indices/0","entities/user_mentions/7/indices/1","entities/user_mentions/7/name","entities/user_mentions/7/screen_name","entities/user_mentions/8/id_str","entities/user_mentions/8/indices/0","entities/user_mentions/8/indices/1","entities/user_mentions/8/name","entities/user_mentions/8/screen_name","entities/user_mentions/9/id_str","entities/user_mentions/9/indices/0","entities/user_mentions/9/indices/1","entities/user_mentions/9/name","entities/user_mentions/9/screen_name","entities/user_mentions/10/id_str","entities/user_mentions/10/indices/0","entities/user_mentions/10/indices/1","entities/user_mentions/10/name","entities/user_mentions/10/screen_name","id","lang","likes","media/photo/0/id","media/photo/0/media_url_https","media/photo/1/id","media/photo/1/media_url_https","media/video/0/aspect_ratio/0","media/video/0/aspect_ratio/1","media/video/0/duration","media/video/0/id","media/video/0/media_url_https","media/video/0/original_info/height","media/video/0/original_info/width","media/video/0/variants/0/bitrate","media/video/0/variants/0/content_type","media/video/0/variants/0/url","place/country","place/country_code","place/full_name","place/more_data_url","place/name","place/place_type","quotes","replies","retweets","status","text","views"
"true","false","CDC's official source for daily credible health & safety updates from Centers for Disease Control & Prevention. Privacy/comment policy: https://t.co/9LbZmE3Wzg","https://pbs.twimg.com/profile_images/1775519665390772225/clcxou-0_normal.jpg","CDC","146569971","CDCgov","5520210","2","1583157385379528704","Thu Oct 20 18:05:09 +0000 2022","CDC recommends everyone 5 years and older get an updated (bivalent) booster, which targets Omicron variants BA.4 and BA.5 and the original strain of the virus that causes COVID-19. Learn more: https://t.co/QZ71L1Wr5L",,,,,,,,,,,,,,,,,,,,,,,,,,,,,,,,,,,,,,,,,,,,,,,,,,,,,,,,,,,,,,,,,,,,,,,,,,,,,,,,,,,,,,,,,,,,,,,,,,,,,,,,,,,,,,,,,,,,,,,,,,,,,,,,,,,,,,,,,,,,,,,,,,,,,,,,,,,,,,,,,,,,,,,,,,,,,,,,,,,,,,,,,,,,,,,,,,,,,,,,,,,,,,,,,,,,,,,,,,,,,,,"bit.ly/mm7142a3","https://bit.ly/mm7142a3","193","216","https://t.co/QZ71L1Wr5L",,,,,,,,,,,,,,,,,,,,,,,,,,,,,,,,,,,,,,,,,,,,,,,,,,,,,,,,"1583157388722737152","en","56",,,,,,,,,,,,,,,,,,,,,"9","95","29","active","CDC recommends everyone 5 years and older get an updated (bivalent) booster, which targets Omicron variants BA.4 and BA.5 and the original strain of the virus that causes COVID-19. Learn more: https://t.co/QZ71L1Wr5L",
"true","true","America Only","https://pbs.twimg.com/profile_images/1524551527808987136/IXM3zZ8s_normal.jpg","Vance Murphy","245567280","vancemurphy","34141","0","1583157385379528704","Thu Oct 20 18:05:56 +0000 2022","I can’t get a booster if I never got the first 4.",,,,,,,,,,,,,,,,,,,,,,,,,,,,,,,,,,,,,,,,,,,,,,,,,,,,,,,,,,,,,,,,,,,,,,,,,,,,,,,,,,,,,,,,,,,,,,,,,,,,,,,,,,,,,,,,,,,,,,,,,,,,,,,,,,,,,,,,,,,,,,,,,,,,,,,,,,,,,,,,,,,,,,,,,,,,,,,,,,,,,,,,,,,,,,,,,,,,,,,,,,,,,,,,,,,,,,,,,,,,,,,,,,,,"146569971","0","7","CDC","CDCgov","111354912","8","16","MMWR","CDCMMWR",,,,,,,,,,,,,,,,,,,,,,,,,,,,,,,,,,,,,,,,,,,,,,"1583157585988833280","en","29",,,,,,,,,,,,,,,,,,,,,"0","2","0","active","@CDCgov @CDCMMWR I can’t get a booster if I never got the first 4.",
"true","true","Fiery, but mostly peaceful | Take Back Oregon | Opinions are my own","https://pbs.twimg.com/profile_images/1641212575441620993/wfHh5XtR_normal.jpg","Coco 🇺🇸","1471208460125540352","CoClarified","47536","0","1583157385379528704","Fri Oct 21 01:55:02 +0000 2022","Fuck off",,,,,,,,,,,,,,,,,,,,,,,,,,,,,,,,,,,,,,,,,,,,,,,,,,,,,,,,,,,,,,,,,,,,,,,,,,,,,,,,,,,,,,,,,,,,,,,,,,,,,,,,,,,,,,,,,,,,,,,,,,,,,,,,,,,,,,,,,,,,,,,,,,,,,,,,,,,,,,,,,,,,,,,,,,,,,,,,,,,,,,,,,,,,,,,,,,,,,,,,,,,,,,,,,,,,,,,,,,,,,,,,,,,,"146569971","0","7","CDC","CDCgov","111354912","8","16","MMWR","CDCMMWR",,,,,,,,,,,,,,,,,,,,,,,,,,,,,,,,,,,,,,,,,,,,,,"1583275637611311104","en","16",,,,,,,,,,,,,,,,,,,,,"0","1","0","active","@CDCgov @CDCMMWR Fuck off",
"false","false","Reporter @justthenews. Formerly @collegefix and @comm_daily. Nathentoffian. This feed is mainly to keep track of story ideas. Obviously my opinions, not JTN's.","https://pbs.twimg.com/profile_images/1834647497366474752/mi4PKQKi_normal.jpg","Greg Piper","13525692","gregpiper","2589","0","1583157385379528704","Thu Oct 20 19:33:48 +0000 2022","Of course you make no acknowledgment of the ubiquitous natural immunity that followed Omicron's dominance, meaning people have excellent protection against *both* reinfection and severe outcomes.",,,,,,,,,,,,,,,,,,,,,,,,,,,,,,,,,,,,,,,,,,,,,,,,,,,,,,,,,,,,,,,,,,,,,,,,,,,,,,,,,,,,,,,,,,,,,,,,,,,,,,,,,,,,,,,,,,,,,,,,,,,,,,,,,,,,,,,,,,,,,,,,,,,,,,,,,,,,,,,,,,,,,,,,,,,,,,,,,,,,,,,,,,,,,,,,,,,,,,,,,,,,,,,,,,,,,,,,,,,,,,,,,,,,"146569971","0","7","CDC","CDCgov","111354912","8","16","MMWR","CDCMMWR",,,,,,,,,,,,,,,,,,,,,,,,,,,,,,,,,,,,,,,,,,,,,,"1583179696912539650","en","11",,,,,,,,,,,,,,,,,,,,,"0","0","0","active","@CDCgov @CDCMMWR Of course you make no acknowledgment of the ubiquitous natural immunity that followed Omicron's dominance, meaning people have excellent protection against *both* reinfection and severe outcomes.",
"true","false","Belongs to Species, the Floridus Nativus","https://pbs.twimg.com/profile_images/1879184132283994112/n_-pwbQz_normal.jpg","Helena Handbasket","10395422","hobbes16","3070","0","1583157385379528704","Thu Oct 20 18:39:12 +0000 2022","",,,,,,,,,,,,,,,,,,,,,,,,,"pic.x.com/g6gLsSqiXQ","https://x.com/hobbes16/status/1583165955718664192/photo/1",,"Available","72","72","304","290",,,,,,,,,"72","72","304","290",,,,,,,,,"72","72","304","290",,,,,,,,,"65","65","277","264",,,,,,,,,"1583165941575286789","17","40","3_1583165941575286789","3_1583165941575286789","https://pbs.twimg.com/media/FfiJCTAXgAUOIRw.png","418","746","0","0","610","610","48","0","610","535","86","0","610","305","201","0","610","746","0","0","610","746","610","fit","746","610","fit","746","556","fit","680","150","crop","150","photo","https://t.co/g6gLsSqiXQ",,,,,,,,,,,,,,,,,,,,,,,,,,,,,,,,,,,,,,,,,,,,,,,,,,,,,,,,,,,,,,,,,,,,,,,,,,,,,,,,,,,,,,,,,,,,,,,,,,,,,,,,,,,,,,"146569971","0","7","CDC","CDCgov","111354912","8","16","MMWR","CDCMMWR",,,,,,,,,,,,,,,,,,,,,,,,,,,,,,,,,,,,,,,,,,,,,,"1583165955718664192","qme","35","1583165941575286789","https://pbs.twimg.com/media/FfiJCTAXgAUOIRw.png",,,,,,,,,,,,,,,,,,,"0","0","1","active","@CDCgov @CDCMMWR https://t.co/g6gLsSqiXQ",
"true","false","I proudly voted for President Trump! Full red pilled Ex Dem centrist. FIGHT, FIGHT, FIGHT! MAGA! Likes & RTs ≠ endorsement.","https://pbs.twimg.com/profile_images/1812504630376431618/b3Hle-92_normal.jpg","Exx Democrat 🇺🇸 🇹🇼","30140123","designertracy","797","0","1583157385379528704","Thu Oct 20 18:20:22 +0000 2022","My kid will never get this. You have no right to force anyone to give this to kids. https://t.co/1W2EBGe6bq",,,,,,,,,,,,,,,,,,,,,,,,,,,,,,,,,,,,,,,,,,,,,,,,,,,,,,,,,,,,,,,,,,,,,,,,,,,,,,,,,,,,,,,,,,,,,,,,,,,,,,,,,,,,,,,,,,,,,,,,,,,,,,,,,,,,,,,,,,,,,,,,,,,,,,,,,,,,,,,,,,,,,,,,,,,,,,,,,,,,,,,,,,,,,,,,,,,,,,,,,,,,,,,,,,,,,,,,,,,,,,,"x.com/katetalkstruth…","https://x.com/katetalkstruth/status/1583151579141898241?s=46&t=2YSnf2R29zjikt6DA8GHlA","101","124","https://t.co/1W2EBGe6bq","146569971","0","7","CDC","CDCgov","111354912","8","16","MMWR","CDCMMWR",,,,,,,,,,,,,,,,,,,,,,,,,,,,,,,,,,,,,,,,,,,,,,"1583161215777271809","en","22",,,,,,,,,,,,,,,,,,,,,"0","1","1","active","@CDCgov @CDCMMWR My kid will never get this. You have no right to force anyone to give this to kids. https://t.co/1W2EBGe6bq",
"false","false","A real-life, Midwestern, middle class, Millennial/borderline Gen Z'er. Mediocre prepper who dabbles in the occasional thoughtcrime.

(Psalm 23:4-6)","https://pbs.twimg.com/profile_images/1988439862983192576/gDAviSTY_normal.jpg","𝔐𝔞𝔡 🐍","1239364726024540161","maddieNamerica","102","0","1583157385379528704","Thu Oct 20 18:07:32 +0000 2022","Such a joke.",,,,,,,,,,,,,,,,,,,,,,,,,,,,,,,,,,,,,,,,,,,,,,,,,,,,,,,,,,,,,,,,,,,,,,,,,,,,,,,,,,,,,,,,,,,,,,,,,,,,,,,,,,,,,,,,,,,,,,,,,,,,,,,,,,,,,,,,,,,,,,,,,,,,,,,,,,,,,,,,,,,,,,,,,,,,,,,,,,,,,,,,,,,,,,,,,,,,,,,,,,,,,,,,,,,,,,,,,,,,,,,,,,,,"146569971","0","7","CDC","CDCgov","111354912","8","16","MMWR","CDCMMWR",,,,,,,,,,,,,,,,,,,,,,,,,,,,,,,,,,,,,,,,,,,,,,"1583157989133123584","en","16",,,,,,,,,,,,,,,,,,,,,"0","0","0","active","@CDCgov @CDCMMWR Such a joke.",
"false","true","Shitposter, crypto enthusiast, animal lover, America Only, 589","https://pbs.twimg.com/profile_images/1876801329802227712/ijQ9J5Vf_normal.jpg","WttippedCreamOnHorsesh!t","1276553996254224384","Yuck15507977","1021","0","1583157385379528704","Thu Oct 20 18:18:08 +0000 2022","Fvck you",,,,,,,,,,,,,,,,,,,,,,,,,,,,,,,,,,,,,,,,,,,,,,,,,,,,,,,,,,,,,,,,,,,,,,,,,,,,,,,,,,,,,,,,,,,,,,,,,,,,,,,,,,,,,,,,,,,,,,,,,,,,,,,,,,,,,,,,,,,,,,,,,,,,,,,,,,,,,,,,,,,,,,,,,,,,,,,,,,,,,,,,,,,,,,,,,,,,,,,,,,,,,,,,,,,,,,,,,,,,,,,,,,,,"146569971","0","7","CDC","CDCgov","111354912","8","16","MMWR","CDCMMWR",,,,,,,,,,,,,,,,,,,,,,,,,,,,,,,,,,,,,,,,,,,,,,"1583160653271175168","tl","17",,,,,,,,,,,,,,,,,,,,,"0","0","0","active","@CDCgov @CDCMMWR Fvck you",
"true","false","Pro freedom. Anti THEM. This means you JT. Time to wake up everyone. Extremely happily married. TRUTH: @TheRealQnadian Bearded Warrior #MapleMaga","https://pbs.twimg.com/profile_images/1814504495222824963/v5O_ydYp_normal.jpg","Qnadian","1074140199993565184","qnadian","1809","0","1583157385379528704","Thu Oct 20 18:22:14 +0000 2022","Charlie Romeo India Mike Echo Sierra. Alpha Golf Alpha India November Sierra Tango. Hotel Uniform Mike Alpha November India Tango Yankee.",,,,,,,,,,,,,,,,,,,,,,,,,,,,,,,,,,,,,,,,,,,,,,,,,,,,,,,,,,,,,,,,,,,,,,,,,,,,,,,,,,,,,,,,,,,,,,,,,,,,,,,,,,,,,,,,,,,,,,,,,,,,,,,,,,,,,,,,,,,,,,,,,,,,,,,,,,,,,,,,,,,,,,,,,,,,,,,,,,,,,,,,,,,,,,,,,,,,,,,,,,,,,,,,,,,,,,,,,,,,,,,,,,,,"146569971","0","7","CDC","CDCgov","111354912","8","16","MMWR","CDCMMWR",,,,,,,,,,,,,,,,,,,,,,,,,,,,,,,,,,,,,,,,,,,,,,"1583161685355147265","es","16",,,,,,,,,,,,,,,,,,,,,"0","0","0","active","@CDCgov @CDCMMWR Charlie Romeo India Mike Echo Sierra. Alpha Golf Alpha India November Sierra Tango. Hotel Uniform Mike Alpha November India Tango Yankee.",
"false","true","Estate planning & small business attorney. Taxing unrealized gains is about as absurd as it gets. No King but Christ.","https://pbs.twimg.com/profile_images/1634440578959015936/mZ1omLHC_normal.jpg","Seth, Esq.®️","433828950","sethesq22","2691","0","1583157385379528704","Fri Oct 21 01:03:48 +0000 2022","",,,,,,,,,,,,,,,,,,,,,,,,,"pic.x.com/JTxxS2EgQb","https://x.com/libertarianJD/status/1583262742945083392/photo/1",,"Available",,,,,,,,,,,,,,,,,,,,,,,,,,,,,,,,,,,,,,,,,,,,,,,,,"1583262741468520448","17","40","3_1583262741468520448","3_1583262741468520448","https://pbs.twimg.com/media/FfjhEytXoAAxvh1.jpg","142","253","0","0","253","253","0","0","288","253","0","0","291","146","107","0","291","253","0","0","291","253","291","fit","253","291","fit","253","291","fit","253","150","crop","150","photo","https://t.co/JTxxS2EgQb",,,,,,,,,,,,,,,,,,,,,,,,,,,,,,,,,,,,,,,,,,,,,,,,,,,,,,,,,,,,,,,,,,,,,,,,,,,,,,,,,,,,,,,,,,,,,,,,,,,,,,,,,,,,,,"146569971","0","7","CDC","CDCgov","111354912","8","16","MMWR","CDCMMWR",,,,,,,,,,,,,,,,,,,,,,,,,,,,,,,,,,,,,,,,,,,,,,"1583262742945083392","qme","6","1583262741468520448","https://pbs.twimg.com/media/FfjhEytXoAAxvh1.jpg",,,,,,,,,,,,,,,,,,,"0","0","0","active","@CDCgov @CDCMMWR https://t.co/JTxxS2EgQb",
"false","false","","https://pbs.twimg.com/profile_images/1967958325279993856/W9_j5uCx_normal.jpg","Mae","405949542","Mae522018","1210","0","1583157385379528704","Thu Oct 20 20:37:37 +0000 2022","How many boosts do you supposed one should get on their lifetime? Efficacy wanes quite quickly.. every 3? Every 6? Is this rly the plan?",,,,,,,,,,,,,,,,,,,,,,,,,,,,,,,,,,,,,,,,,,,,,,,,,,,,,,,,,,,,,,,,,,,,,,,,,,,,,,,,,,,,,,,,,,,,,,,,,,,,,,,,,,,,,,,,,,,,,,,,,,,,,,,,,,,,,,,,,,,,,,,,,,,,,,,,,,,,,,,,,,,,,,,,,,,,,,,,,,,,,,,,,,,,,,,,,,,,,,,,,,,,,,,,,,,,,,,,,,,,,,,,,,,,"146569971","0","7","CDC","CDCgov","111354912","8","16","MMWR","CDCMMWR",,,,,,,,,,,,,,,,,,,,,,,,,,,,,,,,,,,,,,,,,,,,,,"1583195758815105024","en","7",,,,,,,,,,,,,,,,,,,,,"0","1","0","active","@CDCgov @CDCMMWR How many boosts do you supposed one should get on their lifetime? Efficacy wanes quite quickly.. every 3? Every 6? Is this rly the plan?",
"false","true","Bilingual triage RN in primary care
Read ""Wisconsin Death Trip,"" a portrait of life before vaccines & social safety net. We can't go back.","https://pbs.twimg.com/profile_images/2009706925349298176/0-P0PAtT_normal.jpg","Julie","2369049535","raingardener01","1148","0","1583157385379528704","Thu Oct 20 18:08:55 +0000 2022","Please get Novavax approved as a 2nd booster. Cannot repeat  mRNA due to the reaction I had per my  PCP. I have no other option. Policy is putting me at risk.",,,,,,,,,,,,,,,,,,,,,,,,,,,,,,,,,,,,,,,,,,,,,,,,,,,,,,,,,,,,,,,,,,,,,,,,,,,,,,,,,,,,,,,,,,,,,,,,,,,,,,,,,,,,,,,,,,,,,,,,,,,,,,,,,,,,,,,,,,,,,,,,,,,,,,,,,,,,,,,,,,,,,,,,,,,,,,,,,,,,,,,,,,,,,,,,,,,,,,,,,,,,,,,,,,,,,,,,,,,,,,,,,,,,"146569971","0","7","CDC","CDCgov","111354912","8","16","MMWR","CDCMMWR",,,,,,,,,,,,,,,,,,,,,,,,,,,,,,,,,,,,,,,,,,,,,,"1583158334017835008","en","8",,,,,,,,,,,,,,,,,,,,,"0","3","0","active","@CDCgov @CDCMMWR Please get Novavax approved as a 2nd booster. Cannot repeat  mRNA due to the reaction I had per my  PCP. I have no other option. Policy is putting me at risk.",
"false","false","Make Canada Equal for all!  Reposts do not mean I agree.","https://pbs.twimg.com/profile_images/1671591427174801421/KDsJjSe-_normal.jpg","@SparkysMom👩‍🦳","261492615","queenofthorson","954","0","1583157385379528704","Fri Oct 21 06:51:44 +0000 2022","",,,,,,,,,,,,,,,,,,,,,,,,,"pic.x.com/XSG0vrEKPS","https://x.com/queenofthorson/status/1583350302610051073/photo/1",,"Available","95","95","169","137",,,,,,,,,"95","95","169","137",,,,,,,,,"95","95","169","137",,,,,,,,,"95","95","169","137",,,,,,,,,"1583350300848623617","17","40","3_1583350300848623617","3_1583350300848623617","https://pbs.twimg.com/media/Ffkwta0XEAEoPKG.jpg","248","442","0","0","396","396","46","0","396","347","95","0","396","198","221","0","396","442","0","0","396","442","396","fit","442","396","fit","442","396","fit","442","150","crop","150","photo","https://t.co/XSG0vrEKPS",,,,,,,,,,,,,,,,,,,,,,,,,,,,,,,,,,,,,,,,,,,,,,,,,,,,,,,,,,,,,,,,,,,,,,,,,,,,,,,,,,,,,,,,,,,,,,,,,,,,,,,,,,,,,,"146569971","0","7","CDC","CDCgov","111354912","8","16","MMWR","CDCMMWR",,,,,,,,,,,,,,,,,,,,,,,,,,,,,,,,,,,,,,,,,,,,,,"1583350302610051073","qme","4","1583350300848623617","https://pbs.twimg.com/media/Ffkwta0XEAEoPKG.jpg",,,,,,,,,,,,,,,,,,,"0","0","1","active","@CDCgov @CDCMMWR https://t.co/XSG0vrEKPS",
